{"capability":{"name":"example.echo","schema_version":"1"},"contract_version":"1","evidence":[{"digest":"sha256:1111111111111111111111111111111111111111111111111111111111111111","kind":"synthetic-ci","reference":"urn:dubnium:example:evidence:ci-0001"}],"expires_at":"2026-08-05T20:10:00Z","payload":{"max_output_bytes":64,"message":"Hello, Dubnium!","repeat":2},"request_id":"req_echo_00000001","requested_at":"2026-08-05T20:00:00Z","target":{"kind":"example","reference":"urn:dubnium:example:target:echo"}}