{
  "contract_version": "1",
  "request_id": "req_echo_00000001",
  "capability": {
    "name": "example.echo",
    "schema_version": "1"
  },
  "target": {
    "kind": "example",
    "reference": "urn:dubnium:example:target:echo"
  },
  "payload": {
    "message": "Hello, Dubnium!",
    "repeat": 2,
    "max_output_bytes": 64
  },
  "evidence": [
    {
      "kind": "synthetic-ci",
      "reference": "urn:dubnium:example:evidence:ci-0001",
      "digest": "sha256:1111111111111111111111111111111111111111111111111111111111111111"
    }
  ],
  "requested_at": "2026-08-05T20:00:00Z",
  "expires_at": "2026-08-05T20:10:00Z"
}
