{
  "contract_version": "1",
  "request_id": "req_deploy_synth01",
  "capability": {
    "name": "deployment.apply",
    "schema_version": "1"
  },
  "target": {
    "kind": "synthetic-host",
    "reference": "urn:dubnium:synthetic:host:example"
  },
  "payload": {
    "artifact_ref": "urn:dubnium:synthetic:artifact:example",
    "source_revision": "0000000000000000000000000000000000000000",
    "mode": "synthetic-validation-only"
  },
  "evidence": [
    {
      "kind": "synthetic-ci",
      "reference": "urn:dubnium:synthetic:evidence:example",
      "digest": "sha256:2222222222222222222222222222222222222222222222222222222222222222"
    }
  ],
  "requested_at": "2026-08-05T20:00:00Z",
  "expires_at": "2026-08-05T20:05:00Z"
}
